{
  "admission_status": "AVAILABLE",
  "available_at": "2026-08-21T00:00:00.200000Z",
  "causation_event_id": null,
  "contract_name": "event-envelope",
  "contract_version": "1.0.0",
  "correlation_id": "urn:dex-ai:correlation:22222222222222222222222222222222",
  "data_classification": "PUBLIC",
  "event_domain": "CHAIN",
  "event_id": "urn:dex-ai:event:88888888888888888888888888888888",
  "event_stage": "RAW",
  "event_time": "2026-08-21T00:00:00.000000Z",
  "event_type": "RAW_SOURCE_CAPTURED",
  "event_version": "1.0.0",
  "execution_mode": "LIVE",
  "finality_status": "NOT_APPLICABLE",
  "idempotency_key": "sha256:9999999999999999999999999999999999999999999999999999999999999999",
  "ingested_at": "2026-08-21T00:00:00.100000Z",
  "integrity": {"algorithm":"SHA-256","canonicalization":"RFC8785-JCS-PROFILE","digest":"cc0ff9f6c41fd71a354864c2d92bd9891c1834bbfea7503b8a9c69c71044e02b","encoding":"UTF-8","scope":"payload","status":"VERIFIED","verified_at":"2026-08-21T00:00:00.150000Z"},
  "observed_at": "2026-08-21T00:00:00.000000Z",
  "ordering_key": "urn:dex-ai:ordering:synthetic:test",
  "ordering_position": "source:00000000000000000002:synthetic-raw-001",
  "payload": {
    "capture_method": "SUBSCRIPTION",
    "request_or_subscription_ref": "urn:dex-ai:subscription:solana-test-mints",
    "source_endpoint_or_stream": "wss://solana.example.invalid/mint-stream",
    "source_received_at": "2026-08-21T00:00:00.000000Z",
    "http_or_transport_metadata": {"transport":"WEBSOCKET","status_code":null,"content_encoding":"IDENTITY","message_id":"synthetic-message-001"},
    "raw_content_type": "application/json",
    "raw_payload_ref": "urn:dex-ai:raw:5555555555555555555555555555555555555555555555555555555555555555",
    "raw_content_hash": "sha256:6666666666666666666666666666666666666666666666666666666666666666",
    "collector_clock": {"clock_source":"SYSTEM_UTC","captured_at":"2026-08-21T00:00:00.000000Z","uncertainty_ms":1},
    "collection_attempt_id": "urn:dex-ai:collection-attempt:77777777777777777777777777777777",
    "source_cursor_or_checkpoint": "slot:1",
    "redaction_manifest": []
  },
  "payload_hash": "sha256:cc0ff9f6c41fd71a354864c2d92bd9891c1834bbfea7503b8a9c69c71044e02b",
  "producer_name": "synthetic-collector",
  "producer_version": "1.0.0",
  "provenance": {"collection_method":"SUBSCRIPTION","collector":{"name":"synthetic-collector","version":"1.0.0"},"environment":"test","normalizer":null,"observed_at":"2026-08-21T00:00:00.000000Z","origin_kind":"ORIGINAL","parent_artifact_refs":[],"replay_lineage":null,"source_identity":"urn:dex-ai:source:solana-test","transform_chain":[]},
  "quality_flags": [],
  "raw_ref": {"artifact_id":"urn:dex-ai:raw:5555555555555555555555555555555555555555555555555555555555555555","availability":"AVAILABLE","captured_at":"2026-08-21T00:00:00.000000Z","content_hash":"sha256:6666666666666666666666666666666666666666666666666666666666666666","content_type":"application/json","environment":"test","locator":"ipfs://bafybeigdyrsyntheticartifact"},
  "related_entity_refs": [],
  "replay": null,
  "retention_class": "RAW_EVIDENCE_365D",
  "schema_versions": {"envelope":"1.0.0","normalizer":null,"payload":"1.0.0"},
  "source_id": "urn:dex-ai:source:solana-test",
  "source_record_id": "synthetic-raw-001",
  "source_type": "SYNTHETIC",
  "subject_ref": "urn:dex-ai:entity:token:canonical:So11111111111111111111111111111111111111112",
  "trace_context": {"parent_span_id":null,"span_id":"4444444444444444","trace_flags":"01","trace_id":"33333333333333333333333333333333"},
  "verification_status": "VERIFIED"
}

